{
  "$schema": "http://json-schema.org/draft-04/schema#",
  "type": "object",
  "properties": {
    "title": {
      "type": "string"
    },
    "description": {
      "type": "string"
    },
    "author": {
      "type": "string"
    },
    "publishedAt": {
      "type": "string"
    },
    "lastRevisionAt": {
      "type": "string"
    },
    "keywords": {
      "type": "array",
      "items": [
        {
          "type": "string"
        },
        {
          "type": "string"
        },
        {
          "type": "string"
        },
        {
          "type": "string"
        },
        {
          "type": "string"
        },
        {
          "type": "string"
        },
        {
          "type": "string"
        },
        {
          "type": "string"
        },
        {
          "type": "string"
        },
        {
          "type": "string"
        },
        {
          "type": "string"
        },
        {
          "type": "string"
        },
        {
          "type": "string"
        },
        {
          "type": "string"
        },
        {
          "type": "string"
        },
        {
          "type": "string"
        },
        {
          "type": "string"
        },
        {
          "type": "string"
        },
        {
          "type": "string"
        },
        {
          "type": "string"
        },
        {
          "type": "string"
        },
        {
          "type": "string"
        },
        {
          "type": "string"
        },
        {
          "type": "string"
        },
        {
          "type": "string"
        },
        {
          "type": "string"
        },
        {
          "type": "string"
        },
        {
          "type": "string"
        },
        {
          "type": "string"
        },
        {
          "type": "string"
        }
      ]
    }
  },
  "required": [
    "title",
    "description",
    "author",
    "publishedAt",
    "lastRevisionAt",
    "keywords"
  ]
}
