{
  "keywords": [
    "SEELEN UI",
    "ธีม Seelen UI",
    "ธีม Windows ที่กำหนดเอง",
    "การสอนธีม Windows 11",
    "ชุดเครื่องมือออกแบบ UI",
    "วิธีการธีม SEELEN UI",
    "การปรับแต่ง Seelen UI",
    "ธีม UI ที่ดีที่สุดสำหรับ Windows",
    "ชุดเครื่องมือ UI ที่มีน้ำหนักเบา",
    "ชุดรูปแบบโหมดมืด seelen",
    "Minimalist Windows UI",
    "Seelen UI สำหรับนักพัฒนา",
    "สร้างธีม UI ที่กำหนดเอง",
    "คู่มือธีม Windows 10",
    "SEELEN UI BASICS",
    "ชุดเครื่องมือ UI แบบโอเพนซอร์ซ",
    "Seelen UI กับ Rainmeter",
    "ปรับแต่ง windows ui เป็นส่วนตัว",
    "Seelen UI Editor",
    "การปรับแต่งหน้าต่างที่ทันสมัย",
    "ประสิทธิภาพของ Seelen UI",
    "เทมเพลตชุดรูปแบบสำหรับ Seelen",
    "ปลั๊กอิน Seelen UI",
    "เครื่องมือปรับแต่ง Windows 11",
    "เอกสาร SEELEN UI",
    "วิธีการติดตั้งธีม Seelen",
    "Seelen UI สำหรับนักเล่นเกม",
    "ธีมที่ดีที่สุดสำหรับผลผลิต",
    "ธีมชุมชน Seelen UI",
    "Windows UI Design Trends 2024"
  ],
  "title": "SEELEN UI: การสอนพื้นฐานธีม",
  "description": "เรียนรู้วิธีสร้างธีมสำหรับ Seeelen UI",
  "author": "Eythaann",
  "publishedAt": "10-04-2025",
  "lastRevisionAt": "10-04-2025"
}