{
  "keywords": [
    "Потребителски интерфейс на Seelen",
    "Каналите на Seelen",
    "Конюшня Seelen",
    "Seelen nightly",
    "Seelen beta",
    "Актуализации на Seelen",
    "Версии на Seelen",
    "Изтегляне на Seelen",
    "Seelen GitHub",
    "Инсталатор на Seelen",
    "Изданията на Seelen",
    "Заплатки от Селен",
    "Характеристики на Seelen",
    "Seelen ранен достъп",
    "Канали на потребителския интерфейс",
    "Версии на потребителския интерфейс на Windows",
    "Потребителски актуализации на потребителския интерфейс",
    "Стабилни срещу нощни",
    "Бета версия срещу стабилна",
    "Превключване на канала Seelen",
    "Последен потребителски интерфейс на Seelen",
    "Списък с промените в Seelen",
    "Seelen dev builds",
    "Предварително освобождаване на Seelen"
  ],
  "title": "Канали за дистрибуция на Seelen UI",
  "description": "Научете повече за различните канали за дистрибуция на Seelen UI",
  "author": "Етикет",
  "publishedAt": "13-02-2025",
  "lastRevisionAt": "13-02-2025"
}