{
  "keywords": [
    "Seelen ui",
    "Seelen UI თემები",
    "Windows თემები",
    "Windows 11 თემის სამეურვეო",
    "UI დიზაინის ინსტრუმენტები",
    "როგორ თემა Seelen UI",
    "Seelen UI პერსონალიზაცია",
    "საუკეთესო UI თემები Windows- ისთვის",
    "მსუბუქი წონის UI ინსტრუმენტები",
    "მუქი რეჟიმის თემა seelen",
    "მინიმალისტური Windows UI",
    "Seelen UI დეველოპერებისთვის",
    "შექმენით მორგებული UI თემები",
    "Windows 10 თემის სახელმძღვანელო",
    "Seelen ui თემატური საფუძვლები",
    "ღია კოდის UI ინსტრუმენტარიუმ",
    "Seelen ui vs rainmeter",
    "Windows UI პერსონალიზაცია",
    "Seelen UI თემის რედაქტორი",
    "თანამედროვე ფანჯრების პერსონალიზაცია",
    "Seelen UI შესრულება",
    "თემის შაბლონები სელენისთვის",
    "Seelen UI მოდული",
    "Windows 11 პერსონალიზაციის ინსტრუმენტები",
    "Seelen UI დოკუმენტაცია",
    "როგორ დავაყენოთ Seelen თემები",
    "Seelen ui მოთამაშეებისთვის",
    "საუკეთესო თემები პროდუქტიულობისთვის",
    "Seelen UI საზოგადოების თემები",
    "Windows UI დიზაინის ტენდენციები 2024"
  ],
  "title": "Seelen UI: თემის საფუძვლების სახელმძღვანელო",
  "description": "შეიტყვეთ როგორ შექმნათ თემა Selen UI- სთვის",
  "publishedAt": "10-04-2025",
  "author": "eyithaann",
  "lastRevisionAt": "10-04-2025"
}