{
  "keywords": [
    "シーレンUI",
    "シーレンUIテーマ",
    "カスタムWindowsテーマ",
    "Windows 11のテーマのチュートリアル",
    "UIデザイン・ツールキット",
    "シーレンUIのテーマ設定方法",
    "シーレンUIのカスタマイズ",
    "Windows用ベストUIテーマ",
    "軽量UIツールキット",
    "ダークモードテーマ",
    "ミニマルなウィンドウズUI",
    "開発者向けシーレンUI",
    "カスタムUIテーマの作成",
    "Windows 10テーマガイド",
    "シーレンUIのテーマ設定の基本",
    "オープンソースUIツールキット",
    "シーレンUI vs レインメーター",
    "WindowsのUIをパーソナライズする",
    "シーレンUIテーマエディター",
    "モダンウィンドウズのカスタマイズ",
    "シーレンUIのパフォーマンス",
    "セレンのテーマテンプレート",
    "シーレンUIプラグイン",
    "Windows 11のカスタマイズツール",
    "Seelen UI ドキュメント",
    "Seelenテーマのインストール方法",
    "ゲーマー向けシーレンUI",
    "生産性向上に最適なテーマ",
    "シーレンUIコミュニティテーマ",
    "Windows UIデザインのトレンド 2024"
  ],
  "title": "シーレンUIテーマの基本チュートリアル",
  "description": "Seelen UIのテーマを作成する方法を学ぶ",
  "author": "イーサーン",
  "publishedAt": "10-04-2025",
  "lastRevisionAt": "10-04-2025"
}
