{
  "keywords": [
    "Seelen Ui",
    "Kanalên SEELEN",
    "Seelen Stable",
    "SEELEN NIWNE",
    "Seelen Beta",
    "Nûvekirinên Derve",
    "Guhertoyên Seelen",
    "Daxistin Seelen",
    "Seelen Github",
    "Sazkirina Seelen",
    "Derveyên Seelen",
    "Kevirên Deryanê",
    "Taybetmendiyên SEELEN",
    "Gihîştina destpêkê ya seelen",
    "Kanalên ui",
    "Guhertoyên Windows Ui",
    "Nûvekirinên UI yên xwerû",
    "Stable vs Nightly",
    "Beta vs Stable",
    "Kanala seyranê veguherînin",
    "Dawîn Seelen UI",
    "Seelen Changelog",
    "Seelen Dev ava dike",
    "Seelen berî serbestberdanê"
  ],
  "title": "Kanalên belavkirina Deryaya Seelen Ui",
  "description": "Li ser kanalên belavkirinê yên cihêreng ên ji bo Seelen UI-yê hene fêr bibin",
  "author": "ehthaann",
  "publishedAt": "13-02-2025",
  "lastRevisionAt": "13-02-2025"
}
