{
  "keywords": [
    "سیلین UI لائبریری",
    "SLU-lib",
    "ویجیٹ کی ترقی",
    "سیلین UI SDK",
    "سیلین ایکسٹینشنز",
    "سیلین دستاویزات",
    "سیلین UI ٹول کٹ",
    "سیلین ویجیٹ تخلیق"
  ],
  "$schema": "https://raw.githubusercontent.com/Seelen-Inc/sl-blogs/refs/heads/master/metadata.schema.json",
  "author": "سیلین",
  "description": "سیلن UI (SLU-LIB) کے لئے ویجٹ اور ایکسٹینشن بنانے کے لئے آفیشل ڈویلپمنٹ ٹول کٹ",
  "title": "سیلین UI لائبریری کا جائزہ",
  "publishedAt": "2025-06-06",
  "lastRevisionAt": "2025-06-06"
}