{
  "keywords": [
    "Uživatelské rozhraní Seelen",
    "Motivy uživatelského rozhraní Seelen",
    "vlastní motivy systému Windows",
    "Výukový program pro téma systému Windows 11",
    "Sada nástrojů pro návrh uživatelského rozhraní",
    "jak vytvořit téma Seelen UI",
    "Přizpůsobení uživatelského rozhraní Seelen",
    "nejlepší motivy uživatelského rozhraní pro Windows",
    "lehká sada nástrojů uživatelského rozhraní",
    "téma tmavého režimu Seelen",
    "minimalistické uživatelské rozhraní systému Windows",
    "Uživatelské rozhraní Seelen pro vývojáře",
    "vytvářet vlastní motivy uživatelského rozhraní",
    "Průvodce tématem systému Windows 10",
    "Základy tvorby témat uživatelského rozhraní Seelen",
    "open-source sada nástrojů uživatelského rozhraní",
    "Seelen UI vs Rainmeter",
    "přizpůsobení uživatelského rozhraní systému Windows",
    "Editor témat Seelen UI",
    "moderní přizpůsobení systému Windows",
    "Výkon uživatelského rozhraní Seelen",
    "šablony témat pro Seelen",
    "Zásuvné moduly uživatelského rozhraní Seelen",
    "Nástroje pro přizpůsobení systému Windows 11",
    "Dokumentace uživatelského rozhraní Seelen",
    "jak nainstalovat motivy Seelen",
    "Uživatelské rozhraní Seelen pro hráče",
    "nejlepší témata pro produktivitu",
    "Komunitní témata Seelen UI",
    "Trendy v designu uživatelského rozhraní systému Windows 2024"
  ],
  "title": "Seelen UI: Téma: Základy výuky",
  "description": "Naučte se vytvořit téma pro Seelen UI",
  "author": "eythaann",
  "publishedAt": "10-04-2025",
  "lastRevisionAt": "10-04-2025"
}
