{
  "title": "Kanały dystrybucji Seelen UI",
  "description": "Dowiedz się więcej o różnych kanałach dystrybucji dostępnych dla Seelen UI",
  "author": "eythaann",
  "publishedAt": "13-02-2025",
  "lastRevisionAt": "14-06-2025",
  "keywords": [
    "Seelen UI",
    "Kanały Seelen",
    "Stabilny Seelen",
    "Seelen nightly",
    "Seelen beta",
    "Aktualizacje Seelen",
    "Wersje Seelen",
    "Pobieranie Seelen",
    "Seelen GitHub",
    "Instalator Seelen",
    "Wydania Seelen",
    "Łatki Seelen",
    "Funkcje Seelen",
    "Seelen wczesny dostęp",
    "Kanały interfejsu użytkownika",
    "Wersje interfejsu użytkownika systemu Windows",
    "Niestandardowe aktualizacje interfejsu użytkownika",
    "Stabilny vs nightly",
    "Beta vs stabilny",
    "Przełącz kanał Seelen",
    "Najnowszy interfejs użytkownika Seelen",
    "Dziennik zmian Seelen",
    "Kompilacje deweloperskie Seelen",
    "Seelen przedpremierowo"
  ]
}
