{
  "keywords": [
    "seelen docs",
    "seelen ui dokumentatsioon",
    "kuidas kasutada seelen ui",
    "seelen ui paigaldus",
    "seelen setup guide",
    "seelen juhised"
  ],
  "$schema": "https://raw.githubusercontent.com/Seelen-Inc/sl-blogs/refs/heads/master/metadata.schema.json",
  "title": "Dokumentatsioon",
  "description": "Seelen rakenduste dokumentatsiooni keskus",
  "author": "Seelen",
  "publishedAt": "2025-05-05",
  "lastRevisionAt": "2025-05-05"
}