{
  "keywords": [
    "Dokumenty pre seelen",
    "dokumentácia ui seelen",
    "ako používať seelen ui",
    "inštalácia ui seelen",
    "Sprievodca nastavením systému seelen",
    "Pokyny pre seelen"
  ],
  "$schema": "https://raw.githubusercontent.com/Seelen-Inc/sl-blogs/refs/heads/master/metadata.schema.json",
  "title": "Dokumentácia",
  "description": "Centrum dokumentácie aplikácií Seelen",
  "author": "Seelen",
  "publishedAt": "2025-05-05",
  "lastRevisionAt": "2025-05-05"
}
