{
  "keywords": [
    "Seelen ui",
    "Seelen ui Nightly",
    "Seelen UI უახლესი ვერსია",
    "Seelen Ui Nightly განახლებები",
    "Seelen Ui Beta ტესტირება",
    "Seelen ui წინასწარი გამოშვება",
    "შეამოწმეთ seelen ui nightly აშენებს",
    "Seelen UI განვითარების არხი",
    "Seelen UI ექსპერიმენტული თვისებები",
    "ჩამოტვირთეთ seelen ui nightly",
    "Seelen ui changelog",
    "Seelen UI ადრეული წვდომა",
    "Seelen UI Bleeding-Edge განახლებები",
    "Windows UI პერსონალიზაცია ღამით",
    "Seelen ui Nightly შეცდომები",
    "Seelen ui Nightly აფიქსირებს",
    "როგორ დავაყენოთ Seelen Ui Nightly",
    "Seelen ui vs სტაბილური",
    "Seelen ui github nightly",
    "საბაჟო Windows Ui Nightly",
    "Seelen UI განახლების არხი"
  ],
  "title": "Seelen ui Nightly",
  "description": "შეამოწმეთ Seelen UI- ის უახლესი ცვლილებები ღამის განახლების არხით!",
  "author": "eyithaann",
  "publishedAt": "13-02-2025",
  "lastRevisionAt": "13-02-2025"
}
