{
  "title": "Seelen UI: Theme basics tutorial",
  "description": "Learn how to create a theme for Seelen UI",
  "author": "eythaann",
  "publishedAt": "10-04-2025",
  "lastRevisionAt": "10-04-2025",
  "keywords": [
    "Seelen UI",
    "Seelen UI themes",
    "custom Windows themes",
    "Windows 11 theme tutorial",
    "UI design toolkit",
    "how to theme Seelen UI",
    "Seelen UI customization",
    "best UI themes for Windows",
    "lightweight UI toolkit",
    "dark mode theme Seelen",
    "minimalist Windows UI",
    "Seelen UI for developers",
    "create custom UI themes",
    "Windows 10 theme guide",
    "Seelen UI theming basics",
    "open-source UI toolkit",
    "Seelen UI vs Rainmeter",
    "personalize Windows UI",
    "Seelen UI theme editor",
    "modern Windows customization",
    "Seelen UI performance",
    "theme templates for Seelen",
    "Seelen UI plugins",
    "Windows 11 customization tools",
    "Seelen UI documentation",
    "how to install Seelen themes",
    "Seelen UI for gamers",
    "best themes for productivity",
    "Seelen UI community themes",
    "Windows UI design trends 2024"
  ]
}
