{
  "keywords": [
    "Docs Seelen",
    "Belgeya Seelen UI",
    "Meriv çawa Seelen UI bikar tîne",
    "Sazkirina Seelen UI",
    "Rêbernameya Setup Seelen",
    "Rêbernameyên SEELEN"
  ],
  "$schema": "https://raw.githubusercontent.com/Seelen-Inc/sl-blogs/refs/heads/master/metadata.schema.json",
  "description": "Serîlêdanên Seelen Hub belgekirin",
  "title": "Belgekirin",
  "author": "Seelen",
  "publishedAt": "2025-05-05",
  "lastRevisionAt": "2025-05-05"
}
