{
  "keywords": [
    "د",
    "د UI اسناد",
    "څنګه د کوهي نوم ته د غونډو اضافه کولو څرنګوالی",
    "د ښستانه UI لپاره فلګونه رامینځته کړئ",
    "اصلي لارښوونې",
    "د رنګ تسلیمۍ رامینځته کول",
    "د متحده ایالاتو کتابتون وګورئ",
    "سلیپ - لیب"
  ],
  "$schema": "https://raw.githubusercontent.com/Seelen-Inc/sl-blogs/refs/heads/master/metadata.schema.json",
  "author": "تلل",
  "publishedAt": "2025-06-06",
  "title": "د UI کتابتون وګورئ: ډولونه او انٹرفیس",
  "lastRevisionAt": "2025-06-06",
  "description": "د UI کتابتون وګورئ (سلیپ - ايل) هغه کتابتون دی چې ډولونه او انفافرونه د ویجاړو په واسطه کارول کیږي"
}
